,date,retweets,favorites,label,text
20954,03/08/19 20:53,0,1,2,"Yet another gun shooting. When will enough finally be enough before we get COMMON SENSE gun control, which BOTH PARTIES agree on! Congress, you work FOR US!!! Get it done!!!! #GunControlNow"
44330,05/08/19 11:15,0,0,3,"@foxandfriends spin it any way you want, mental illness, video games... blah blah. You are complicit in the shooting in ELPaso. pic.twitter.com/4xC9Rj3fXE"
20585,03/08/19 20:56,0,0,3,"These shootings in America has to stop! Now, it’_’_Î_s El Paso! Where will it be next? PLEASE STOP!!!!!!! #GunControlNow"
58596,05/08/19 3:17,0,1,3,They will find somewhere else to meet. 86 the mental illnes. 8chan has become a meeting place for 'extremist hate.' The founder says it's time to shut it down https://www.usatoday.com/story/news/nation/2019/08/04/8-chan-third-mass-shooting-2019-linked-webs-darkest-reaches/1917135001/ ’_’__
4939,03/08/19 23:19,0,1,3,"Where’_’_Î_d you get the silly idea I’_’_Î_m anti-2A? As a vet, I’_’_Î_m trained, and a responsible gun owner, but I also realize 2A is only amendment in Constitution to explicitly include the word ’_’_’Œregulated’_’_Îù in it."
301,03/08/19 23:57,0,1,2,"Someone needs to make a gif of Trump and McConnell with their hands dripping with blood. I know this is a completely hideous thought - but some people seriously need to get shaken out of their apathy, or desensitization or just plain old denial. #BanAssaultWeapons #BanTrump"
68967,05/08/19 0:42,0,0,3,"Yes, but the #ElPaso mayor refuses to speak the truth!!"
20451,03/08/19 20:57,0,1,3,Strength and support to the victims in #ElPaso
1228,03/08/19 23:50,0,1,2,Fuck prayers and thoughts ... Do something now !! Fix the problem now .. #NOMORE #StopGunViolence
34818,03/08/19 16:20,1,8,3,Thank you to all the teachers who shared their personal stories at @ESCRegion19's Meet & Greet. We were moved by your inspiring journeys! TFCU is proud to help shine a light on the area’_’_Î_s most talented teachers. Tune in tonight for Region 19’_’_Î_s Facebook live coverage. #ESC19TOYpic.twitter.com/zK5RqObanA
47965,05/08/19 8:47,0,1,3,"Extremist message board 8chan, used by three alleged killers in last six months to distribute racist and white nationalist manifestos prior to mass shootings, has lost protection of security service provider in wake of the El Paso attack https://www.theguardian.com/technology/2019/aug/04/8chan-cloudflare-terminate-contract-el-paso-white-nationalist-manifesto ’_’__"
65164,05/08/19 1:46,0,0,3,"After reading a bunch of anti-guns/ #GunControlNow tweets to #EnoughIsEnough and then the follow up comments, holy shit, the sheer amount of people declaring and certifying their 'right' to have guns is ridiculous and why nothing will change in America."
2872,03/08/19 23:38,1,3,2,"When the 2nd Amendment was written, the best trained soldiers could fire 2 rounds per minute and were inaccurate at 50 yards The world has changed. The time for us to change was a long time ago The NRA’_’_Î_s fight for inaction is beyond indefensible #GunControlNow #ElPaso"
45613,05/08/19 10:37,0,0,3,Will they shut down 8chan? Ffs there's a body count associated with this shit. Meanwhile Twitter is locking people in jail for calling out these white supremacist mfers.
45953,05/08/19 10:23,0,0,3,"BTW, the definition of ""arms"" in 2A includes all weapons, accoutrements, clothing, accessories, everything necessary for militia duty. Notice that on April 19th, 1775, the government came not for muskets but cannon, powder & shot."
39100,05/08/19 13:02,3,17,2,The Dayton shooter was killed by police within 30 seconds of the first shot fired. 30 seconds was all it took to take 9 lives and injure 27 others. #BanAssaultWeaponsNow #EndGunViolence #DaytonStrong #ElPasoStrong
39209,05/08/19 13:00,0,4,2,Funny how we never hear about mental illness resulting in vacuuming the hell out of someone’_’_Î_s car or grocery shopping til they faint. The problem is access to guns. How long are we going to continue to lie about this in order to protect bullies with guns crying about their 2A?
31561,03/08/19 19:05,0,0,2,Oh this is just so heartbreaking. And infuriating that anyone defends doing nothing. #GunControlNow
66659,05/08/19 1:21,0,0,3,"You are despicable. Utterly despicable. Imagine the pain of this young man's family when they find out their loved ones memory has been sullied by your crazy conspiracy theories. He shares a similar name, but that is all. Shame on you & your gullible followers. #daytonshooting pic.twitter.com/AGyP0H8MTI"
65426,05/08/19 1:42,0,0,3,8chan proves that you cannot have safety without giving the government some level of backdoor access and surveillance capabilities to investigate criminals and terrorists. It was created by the critics of Bush era Patriot Act & NSA surveillance expansion
13309,03/08/19 21:56,0,0,3,"We all know nothing is going to happen. No #GunSense laws will be passed. Donald Trump won't tone down his rhetoric. We know, nothing will happen. We also know more people are gonna die."
33564,03/08/19 18:25,2,6,3,Prayers out to all my elpaso ppl
25148,03/08/19 20:14,0,0,2,how can you still pretend you’_’_Î_re emotional and acting human toward theses situations and not pass a bill on guns restrictions? #EndGunViolence
58932,05/08/19 3:12,0,1,2,"Yeah Ana, I'm sure they're just for hunting... #GunControlNow"
45905,05/08/19 10:24,0,0,3,Just read this: Please confirm Content Delivery Network @Cloudflare stopped serving up the 8chan website in the middle of the night. Bit Mitigate @bitmitigate will now be serving up the site.
17232,03/08/19 21:25,22,65,2,"Firearms are, in essence, deadly hardware. They're for-profit retail products, artificially elevated to mythic status by the greatest marketing plan in the history of the country. The NRA/GOP are cynically exploiting the 2A as a convenient advertising scheme to sell more guns. https://twitter.com/bobcesca_go/status/1157761950245412865 ’_’__"
20689,03/08/19 20:56,0,0,1,"Who asked for your opinion? A lackey who worked for Obama and Everytown is attacking #2A rights. Those are rights that the CDC said are used up to 3,000,000 times every year. I won't have a duplicitous gun banner make it harder to defend me and mine."
39875,05/08/19 12:48,35,80,3,"""The president has made my community and my people the enemy ... His words and his actions have played a role in this."" @RepEscobar #ElPasoShooting #ElPaso https://twitter.com/Morning_Joe/status/1158341646427312128 ’_’__"
15089,03/08/19 21:43,0,1,1,"Let me break it down for some of you folks. Gun laws don't stop bad guys. Gun laws affect law-abiding citizens, that's it! Bad guys could care less. #GunControlNow #massshooting"
47193,05/08/19 9:28,0,0,2,How are these tragedies ’_’_’Œunthinkable’_’_Îù when they are happening DAILY? I guess thoughts and prayers aren’_’_Î_t working to well. @nra @realDonaldTrump @GOP #policychange #guncontrol #backgroundcheck
38607,05/08/19 13:12,0,0,3,"Praying for ELPASO ,TX ...."
16307,03/08/19 21:33,0,0,3,The fact that we have so many mass shootings in America and Congress refuses to do anything about #GunControl shows you very clearly that they don't care about you one bit. Unless you're going to give them your money or your vote you are literally dead to them.
67281,05/08/19 1:11,4,4,2,"If u're a white Ally, do more than read think pieces and RTs. Let's see you take to the streets, shut down business as usual, and demand that legislators pass meaningful #guncontrol legislation, #abolishice and dismantle the #whitesupremacist police state"
70775,05/08/19 0:08,0,0,3,"The Problem Isn’_’_Î_t 8chan. It’_’_Î_s Americans. https://ift.tt/2MFl5Qi tech ’_’_’ŒIf 8chan is shutdown here is what will happen: someone else will spin up a new imageboard, say 20chan or whatever. People will flock to that.’_’_Îù Ryan Broderick BuzzFeed News Reporter ’_’__"
37419,05/08/19 13:32,0,1,3,"There are no #BothSides in the #ElPaso and #DaytonOH shootings. It's just #TrumpsTerrorists who've all been radicalised by the hateful rhetoric from this so-called ""president"". #WhiteSupremacistTerrorism"
24108,03/08/19 20:24,1,1,3,Important #ElPaso https://twitter.com/selectedwisdom/status/1157738150652985345 ’_’__
47757,05/08/19 8:58,0,0,3,@AnaCabrera everyone needs extra love after this sad we . #EnoughIsEnough how many #drawings like that do I have to make to cover those #massshootings ?3 in a damn week #ElPasoShooting #daytonshooting #garlicfestivalshooting #GunControlNow #RIP #USA #NeverForgetpic.twitter.com/vxeiFrLxe8
35093,03/08/19 14:23,21,52,2,These amazing #GunSense advocates travelled over 500 miles from Indiana to join nearly 2000 @MomsDemand change agents at #GSU19 in Washington DC. #KeepGoing #ExpectUs #EndGunViolence pic.twitter.com/XV5fJNVmmQ
63960,05/08/19 2:02,10,13,3,"In a separate tragedy, the suspected killer in the Poway, California synagogue shooting also posted a hate-filled ’_’_’Œopen letter’_’_Îù on 8chan. 8chan has repeatedly proven itself to be a cesspool of hate."
69522,05/08/19 0:33,0,0,2,I’_’_Î_m so tired of mourning. I’_’_Î_m tired of this perpetual fear. #GunControlNow
51787,05/08/19 5:59,0,2,2,He probably threw himself down the stairs to avoid having to call a vote on #electionsecurity or #guncontrol. Won’_’_Î_t work @senatemajldr aka #MoscowMitch.
25572,03/08/19 20:11,1,7,3,Yeh...we are going to need something a little stronger then prayers. #ElPaso
18422,03/08/19 21:14,0,2,3,Looks like we forgot to build a wall between us and Dallas... shooter is from Dallas #elpaso #lovemycity
42359,05/08/19 11:59,0,0,1,So here we go. You have already done more damage to our 2a rights than any other president in the last 50 years. Cant wait to see what comes out of this one. The dems are gonna crucify you no matter what you do. How about not pissing off your base too.
26863,03/08/19 19:57,0,0,2,"And yet ANOTHER #MassShooting in #ElPaso #Texas. When will your elected representatives wake up & address this problem, #America??? Do the #SecondAmendment rights of the shooters TRUMP the rights of the innocent victims? #GunContolNow #USpolipic.twitter.com/GWP59Tkb0A"
14561,03/08/19 21:47,0,1,2,"As long as malls and stores make themselves GUN FREE ZONES,this will continue!! #ElPaso #massshooting #ElPasoStrong"
17398,03/08/19 21:24,0,0,2,"El Paso shooting: Multiple people have been killed, a city official says. #GunControlNow #ElPasoShootinghttps://www.cnn.com/2019/08/03/us/el-paso-shooting/index.html ’_’__"
69775,05/08/19 0:27,2,1,3,Elpaso shooter is a registered Democrat in Green county. Confirmed. Media is lying. Connor Betts is a liz Warren supporter https://m.washingtontimes.com/news/2019/aug/4/connor-betts-ohio-gunman-was-elizabeth-warren-supp/ ’_’__
29621,03/08/19 19:29,0,3,3,Each one of these mass shootings that occur give further proof that @realDonaldTrump and the @GOP are too weak and scared and powerless to do a damn thing about it. Fucking pussies. #ElPaso
1723,03/08/19 23:46,0,1,2,You won’_’_Î_t do anything about gun safety or mental health or even distance yourself from the hateful rhetoric that promotes these acts of violence coming from @POTUS but hey... thanks for your concern. #gunsense https://twitter.com/GregAbbott_TX/status/1157716557566492674 ’_’__
67874,05/08/19 1:00,0,0,2,This is horrifying people like this believe the ’_’_’Œright’_’_Îù to own a gun is worth more than a human life. They are nothing but dangerous white nationalists with murder weapons. #TrumpsTerrorists #massshootings #GunControlNow #WhiteSupremacistTerrorismhttps://twitter.com/Oathkeepers/status/1157799401735065602 ’_’__
53890,05/08/19 4:57,1,3,1,"And this, my friends, is why the founders enumerated 2A. Tyrants who want to disarm you. https://twitter.com/dcexaminer/status/1158196376418885632 ’_’__"
50262,05/08/19 6:59,0,1,3,"Gumby is back! Hispandering did not work, claiming that Î‘’äTexas is in playÎ‘’ä was boring, but gun control in the aftermath of two mass attacks? One of them happened in #ElPaso, so now #Beto gets to speak ex cathedra--& ppl will listen! (oddly enough)https://twitter.com/MadamClinton/status/1158222554814976000 ’_’__"
19190,03/08/19 21:08,0,2,3,"You know in Watership Down, that warren with the big, rich rabbits who periodically and randomly fall victim to the shining wire? How it's never mentioned, always the focus is elsewhere, but the losses permeate everything? This is America and gun violence. #ElPaso"
43633,05/08/19 11:31,0,1,3,Does she now her name is in the Manifesto of the ElPaso killer?
4051,03/08/19 23:28,0,1,2,"Spent the day with family. Sad to come home to the tragic news of another mass shooting, and here in Texas as well. My heart is breaking for you, El Paso. #GunControlNow"
4627,03/08/19 23:23,95,338,2,"AK-47s don't kill people, they kill a lot of people #GunControlNow El Paso pic.twitter.com/XIvGxElkI7"
55808,05/08/19 4:08,0,0,2,Do something. Now. #gunreformnow #GunControlNow
21445,03/08/19 20:49,0,0,3,Walmart is in shock but they're still selling guns? #ElPaso https://twitter.com/Walmart/status/1157731382304616453 ’_’__
68248,05/08/19 0:54,0,0,3,Why the hell is 8chan still online? - Mashable https://apple.news/AVuvVopLITN-NBRolImUBSw ’_’__
64547,05/08/19 1:54,21,108,3,"Just to clarify, I don't support shutting down 8chan. Instead what I support is a government audit as to why the Feds are on there steering the conversation. https://twitter.com/MisterAntiBully/status/1158177297503064064 ’_’__"
61363,05/08/19 2:37,0,1,3,"Law enforcement will still be able to snoop if they go underground. Cybercrime investigators are kind of good at infiltrating online communities. Like, here's the thing: no law enforcement org is saying ""we don't want 8chan taken down"", it's cloudflare using that as the excuse."
39320,05/08/19 12:58,0,0,1,Every American should honor their 2A right to purchase a gun by going out and getting one. We all need to realize how important this constitutional right is. Without it we would be Venezuela.
62192,05/08/19 2:25,0,0,2,THE ONLY WAY TO STOP GUN VIOLENCE IS TO BAN GUNS FROM STORES!! #EndGunViolence #EndGunViolenceNOW #ENDviolence
49054,05/08/19 7:50,0,1,2,"Americans: Put a man on the moon, invented the internet, mobile phones, microwave ovens, GPS, personal computers, first to fly an airplane etc etc Americans: Wont ban automatic rifles to save lives #daytonshooting #ElPasoShooting #gilroyshooting"
49674,05/08/19 7:22,1,0,3,#8chan #cloudflare Cloudflare cuts off extremist site 8chan after multiple shootings http://dlvr.it/R9h1YS pic.twitter.com/4dJFx4edRj
35548,03/08/19 8:18,0,0,2,A rule of chess is very good That move someone even on your ones Can not kill ... I wish this rule should be in humans also. #savehuman #GunControlNow
75,03/08/19 23:59,0,0,1,@senatemajldr Please continue to protect my 2A rights. https://twitter.com/senatemajldr/status/1157787985041088513 ’_’__
54330,05/08/19 4:45,0,0,3,8chan cut loose by security firm for ’_’_’_hate-filled’_’_Î_ content https://www.movetosydney.com/8chan-cut-loose-by-security-firm-for-hate-filled-content-2/ ’_’__
49542,05/08/19 7:27,0,0,1,Monday Challenge: Name a non-oppressive movement that ends with ’_’_’Œcontrol’_’_Îù #GunControl is oppression #2A #SecondAmendment
32938,03/08/19 18:41,0,0,3,Heart goes out to our brothers and sisters from #ElPaso..
38448,05/08/19 13:15,0,0,3,8chan: the far-right website linked to the rise in hate crimes | Technology | The Guardian https://www.theguardian.com/technology/2019/aug/04/mass-shootings-el-paso-texas-dayton-ohio-8chan-far-right-website ’_’__
59031,05/08/19 3:10,0,0,3,#Cloudfare pulling the plug on #8chan FINALLY SOMEONE is doing something about these #TERRORIST HUBS! say bye bye to the #QCulthttps://twitter.com/eastdakota/status/1158192506086891520 ’_’__
33877,03/08/19 18:17,11,13,2,BREAKING: Active shooter at El Paso mall with multiple injuries reported. Just another day in #Murica #GunControlNow #GunReformNow https://www.rawstory.com/2019/08/active-shooter-reported-at-el-paso-mall/ ’_’__pic.twitter.com/44zY5VPbye
24752,03/08/19 20:18,1,0,3,"#Texas #ElPaso #Walmart #walmartshooting #massshooting Texas shooting: El Paso police say multiple people dead, suspect in custody after mall attackhttps://www.latimes.com/world-nation/story/2019-08-03/el-paso-texas-reports-of-shooting ’_’__"
49940,05/08/19 7:10,0,0,2,"Dude I love angry Twitter, it reminds me that people DO give a fuck about what happens. We just need to to something about this. #GunControlNow"
49189,05/08/19 7:43,6,43,2,"your right to a firearm does not outweigh the right for other people to pursue life, liberty, and happiness (aka going to church, school, shopping centers, etc) not ONE right in the constitution is absolute so stfu about your 2A. if you aren’_’_Î_t pissed, you aren’_’_Î_t paying attention"
14537,03/08/19 21:47,0,0,3,Late but in earnest! Thank You Amy. #ElPaso https://twitter.com/amyklobuchar/status/1157761754199314432 ’_’__
21202,03/08/19 20:51,1,2,2,"Australia needed only one wake-up call. In America, we keep hitting snooze. WAKE UP! Do something, Congress! #GunControlNow #ElPaso #MassShooting #EndGunViolence"
8804,03/08/19 22:39,0,1,2,Say it with me.... #ThanksTrump #GunControlNow
7842,03/08/19 22:48,0,4,3,"The #ElPaso shooter wrote a manifesto that talked about his hatred for Hispanics. So when you ask ’_’_’Œwhere was he radicalized’_’_Îù, look no further than the words coming out of the mouth (and cesspool of a twitter feed) of the current occupant of the White House."
11883,03/08/19 22:09,0,0,3,President #DonaldTrump was focused on a Saturday mixed martial arts as a mass shooting in #ElPaso gripped the attention of America on Saturday. https://www.rawstory.com/2019/08/trump-tweeted-perfunctory-support-for-el-paso-victims-and-15-minutes-later-praised-ufc-fighter-with-maga/ ’_’__ #ElPasoShooting #UnitedStates
60449,05/08/19 2:50,0,1,3,8chan has become a meeting place for 'extremist hate.' The founder says it's time to shut it down https://www.usatoday.com/story/news/nation/2019/08/04/8-chan-third-mass-shooting-2019-linked-webs-darkest-reaches/1917135001/ ’_’__ via @usatoday
39133,05/08/19 13:02,0,0,3,"NO, THIS IS ON YOU #ElPaso @GregAbbott_TX #ImpeachTrump @realDonaldTrump @GOP @GOPLeader @SenateMajLdr @LindseyGrahamSC @JohnCornyn @SenTedCruz @RepMcCaulhttps://twitter.com/realDonaldTrump/status/1158340095608610816 ’_’__"
28989,03/08/19 19:35,0,0,2,But it is about #GunControlNow and #politics
2958,03/08/19 23:37,0,1,3,I'm so sorry #ElPaso https://twitter.com/jaketapper/status/1157797410535550978 ’_’__
51633,05/08/19 6:04,0,0,3,"Cloudflare is dropping 8chan. Vigilantes will take care of them starting about 12 am PT, no 1st amendment violations involved."
55062,05/08/19 4:26,2,6,1,"The moment Americans give up their guns, they will be victimized. Throughout history, even from ancient times, we see what happens to a society when they can't arm themselves, whether it's with sword or gun... #DaytonOhioShooting #ElPasoShooting #2A #MAGA2020"
31788,03/08/19 19:02,1,3,3,666 days separate the #Route91 #Harvest #Festival & the #Gilroy Garlic Harvest Festival. 6 more days separate today’_’_Î_s #ElPaso #walmartshooting . 666 x 6 = 3996 & 3996 mins is equal to 66.6 hours. I cover the particulars of this here -> https://zenofmakaveli.com/2017/08/12/444/ pic.twitter.com/X47BglcZZU
19908,03/08/19 21:02,0,1,2,"Each week there are one or more mass shootings in America and for some reason the NRA and certain people in our government do not think this is a big deal! LIVES ARE TAKEN, PRECIOUS LIVES! #FucktheNRA #GunControlNow"
37651,05/08/19 13:29,0,1,2,Anyone wanna bet that baby killer in #ElPasoShooting #ElPasoTerroristAttack had an @Xbox and played #Fortnite these kids and young people become numb and immune to shooting and killing. #BanAssaultWeapons and #violent #videogames
31814,03/08/19 19:01,2,10,2,"Active shooters, inactive lawmakers. It’_’_Î_s not too soon, it’_’_Î_s too late. 100 every day when it should be zero. #ElPaso #VoteThemOut #gunreformnow #EndGunViolence #BreakThePattern @MomsDemand @Everytown @shannonrwatts"
55494,05/08/19 4:15,0,0,2,"Let Me Just Say, Thoughts and Prayers ARE NOT enough anymore. People are dying at the hands of racist in the U.S. It is about time we have some common sense gun reform in the United States. THE KILLING MUST STOP !!! #GunControlNow #GunReform #EndGunViolence #StopGunViolence"
51918,05/08/19 5:54,0,0,3,Tech Company Cloudflare Says It’_’_Î_s Kicking Extremist Forum 8chan Off Its Network https://www.huffpost.com/entry/cloudflare-terminates-service-8chan_n_5d479439e4b0acb57fce8dfe ’_’__ #cybersecurity #infosec #security
32294,03/08/19 18:54,0,0,3,El Paso active shooting: Police confirm multiple fatalities.... #texas #unitedstates #BreakingNews #elpaso https://therightnews.ca https://www.elpasotimes.com/story/news/crime/2019/08/03/el-paso-police-report-shooter-walmart-cielo-vista-mall/1910012001/ ’_’__
58288,05/08/19 3:23,6,29,2,This is all very sensible’_’_’Âbecause it’_’_Î_s common sense #GunControl. And therefore the @NRA-bribed allegedly ’_’_’Œpro-life’_’_Îù Republican political hacks will publicly advertise a thought and promise a prayer. And then privately go golfing. With their security and billet-proof vest.
24907,03/08/19 20:17,0,0,2,Alright thanks. We appreciate it that you are pledging support. Now PASS REFORMS THIS SHOULD NOT KEEP HAPPENING #ElPaso #PrayForElPasohttps://twitter.com/realDonaldTrump/status/1157745635254243329 ’_’__
69209,05/08/19 0:38,0,5,3,Had to explain what a mass shooting was to my five year old tonight. Then: we talked about what to do if a crazy person ever pulled a gun while he and I are out somewhere. Welcome to this fucking country y’_’_Î_all. #massshootings #America #GunControlNow
5755,03/08/19 23:11,0,0,3,Enough with thoughts & prayers from do nothing politicians like @senatemajldr @tedcruz @GOP #GunControlNow
42041,05/08/19 12:06,0,0,3,What do you expect from a party that supports & CELEBRATES murdering a BABY full term in the womb !!! Democrats hate Democrats are evil! #Ohio #ElPasoTerroristAttack #OhioShooting #walmartshooting #Ohiomassshooting #DaytonOhioShooting #BANDEMOCRATS #ThesePeopleAreSick #elpaso
50689,05/08/19 6:40,0,3,3,If you live in #ElPaso please send me a dm
24770,03/08/19 20:18,3,14,2,"""God be with you all"" is trying to be the new ""thoughts and prayers"" from @realDonaldTrump Honestly, all lawmakers that won't do anything about gun control, just don't bother saying or tweeting anything. Just give the finger and say you can't be bothered. #ElPaso #GunReformNow"
18012,03/08/19 21:18,0,0,3,Common sense should tell you why this evil person drove all the way to ElPaso to kill people
55774,05/08/19 4:09,0,2,2,"Hope it billions. $$$seems 2B only thing GREEDY & CORRUPT @realdonaldtrump, @HouseGOP, @SenateGOP, @HouseDemocrats & @SenateDems understand. If it hits them in their wallets maybe they'll pass common sense reforms. 2A , but NO ONE NEEDS an AR-15 type weapon 4 home defense!"
3211,03/08/19 23:36,0,1,3,Maaaan.... Not another shooting... #Prayers #ElPaso #Texas
46098,05/08/19 10:17,0,0,1,NO. The #2A should never be infringed.
69106,05/08/19 0:39,1,7,3,Now do the dude up in Dayton. It does look like one is sure a Dem and the ElPaso creep is one too. Not big fan of Pres Trump. We shall see but most importantly innocent people were murdered. Innocent people were murdered under last president and the one before him and on. Nut bag
18240,03/08/19 21:16,0,2,2,"I remember after Parkland, we all said ’_’_’Œ #NeverAgain’_’_Îù . It did not take long for us to be proven otherwise. #GunControlNow"
12432,03/08/19 22:03,0,0,2,"America loves guns more than its children. Or its moms, or dads, sons and daughters, or others, or cousins, or aunties or uncles, or grammy and grampy. Gurl, you know it's true. #Impeach #GunControlNow https://twitter.com/DPJHodges/status/611943312401002496 ’_’__"
4931,03/08/19 23:19,0,1,2,"Talk about gun control before the next mass shooting or after the last mass shooting in the US. Same difference. El Paso is not the last. None were the last. There will be more. And more, and more. #BanGuns https://twitter.com/ReaganTMan/status/1157764389358977024 ’_’__"
56304,05/08/19 3:59,0,0,3,https://blog.cloudflare.com/terminating-service-for-8chan/?utm_source=webuproar ’_’__ Terminating Service for 8Chan
60934,05/08/19 2:43,0,1,3,So I've put off reading about all this stuff with the recent shooting. It really looks like we people that had metal issues. One was an 8chan lurker or whatnot.. 8ch makes 4chan look like the kiddie pool. The other one seemed to be fully upset about how the world was going.
36802,05/08/19 13:42,0,1,1,"Stop with the nra canned reply, this issue isn’_’_Î_t necessarily about taking guns away it’_’_Î_s about creating a better screening process, licensing & limiting availability...there are nearly as many guns in this country as there are people: unnecessary....2A? It needs amending"
5104,03/08/19 23:17,0,0,3,"Another mass shooting. Another senseless loss of lives. Another a$$hole (likely w/mental health issues)shattering untold numbers of people's worlds. Another round of empty, meaningless words from the politicians. WHEN ARE WE GOING TO DEMAND REAL CHANGE? #ElPaso #ElPasoShooting"
1539,03/08/19 23:48,0,0,2,I’_’_Î_m not thinking. I’_’_Î_m not praying. Act!! #GunReformNow #ElPaso pic.twitter.com/mIzFYKvnZG
