,date,retweets,favorites,label,text
40081,05/08/19 12:44,0,0,2,"Nice try, the immigrants are locked up & hiding. They aren’_’_Î_t shooting anyone. #ElPasoTerroristAttack #GunControlNow ’_ÎÅ_ @realDonaldTrump’_ÎÅÎ©https://www.thedailybeast.com/trump-wants-new-gun-laws-to-be-married-to-immigration-reform?via=ios ’_’__"
30893,03/08/19 19:15,0,0,3,"OMG, When is the carnage going to stop? #ElPaso #CowardlyGOPCongress #GOPComplicitInMurder #NRABoughtAndPaidFor #TrumpStooges"
39633,05/08/19 12:52,0,0,3,Pause for thought... re white terrorism and the gamification therein - ’_’_’ŒAmazon is profiting from the 8chan audience. It could easily stop Watkins from financing 8chan through http://Amazon.com but has not acted. ’_’_’Œ White terrorismhttps://popular.info/p/white-terrorism ’_’__
58274,05/08/19 3:23,0,0,2,Get ready to memory hole this shit and continue to obsess over the El Paso psychopath instead. #GunControlNow Alternative point of view: Yin and Yang https://twitter.com/infolibnews/status/1158160673936957442 ’_’__
53495,05/08/19 5:07,0,0,3,"Cloudflare CEO on why the company terminated DDoS protection service for 8chan: the site was ""lawless and that lawlessness has caused multiple tragic deaths"" (Matthew Prince/The Cloudflare Blog) - Apple Watch 101 - http://applewatch101.com/cloudflare-ceo-on-why-the-company-terminated-ddos-protection-service-for-8chan-the-site-was-lawless-and-that-lawlessness-has-caused-multiple-tragic-deaths-matthew-prince-the-cloudflare-blog/ ’_’__"
31411,03/08/19 19:07,1,7,3,It's Saturday. All twenty-two victims had something fun planned for this evening. Three assholes canceled those plans. #ElPaso
61216,05/08/19 2:39,1,7,3,@TimMcDermott6 @PhilaUnion I have never been as proud of my team as I am now for supporting @AleBedoya17 #boysinblue #doop #GunControlNow
19980,03/08/19 21:01,0,0,2,My heart goes out to all the victims of the El Paso shooting and their families #GunControlNow #ElPasoShooting
14775,03/08/19 21:45,0,0,3,Scary!! Very very scary.... At least 18 people were killed by a gunman in #ElPaso USA. #ElPasoStrong
45894,05/08/19 10:25,0,0,1,".00006%, roughly 6k out of 100million gun owners are committing the crimes with guns. How does it make sense to take away the 2A?"
39860,05/08/19 12:48,0,0,2,"I want to see the faces of the people, who defend the second amendment, when their loved ones make the list of the next mass shooting #GunControlNow #StopGunViolence"
33388,03/08/19 18:30,2,3,3,"There might be a better local station, but this one is live... #ElPaso https://www.ktsm.com/9-stream-ktsm/"
59151,05/08/19 3:08,0,3,3,"Removing 8chan is literally the most fucked up solution ever. Not only does it flat out not improve a shooter's mental state, it just makes the problem much much worse"
69180,05/08/19 0:38,0,0,3,@tysonritter I grew up 15 min. from the Oregon District (a high crime area). I guess the shooter had a mental problem & was bullied because of it. His sister was one of his victims. My heart goes out to the victims & their families. We need to take action now! #BanAssaultWeapons
62460,05/08/19 2:21,0,0,3,"8chan Is a Megaphone for Gunmen. ’_’_’_Shut the Site Down,’_’_Î_ Says Its Creator. https://www.nytimes.com/2019/08/04/technology/8chan-shooting-manifesto.html ’_’__"
50737,05/08/19 6:38,0,0,3,"8chan Is a Megaphone for Gunmen. ’_’_’_Shut the Site Down,’_’_Î_ Says Its Creator. - The New York Times https://www.nytimes.com/2019/08/04/technology/8chan-shooting-manifesto.html ’_’__"
55458,05/08/19 4:16,1,1,3,Watch @DaHonestyPolicy's broadcast: #PoliticalRumble #’êÎÜ’À’ê’_’â’êÎÜ’__5’êÎ_’ö_’ê_Î‚’«Î‚’_’«Î‚’ö #KashmirBleeds #DaAngels #MassShootings #2A #N’_’__https://www.pscp.tv/w/cBelIjIwNTM4NjZ8MVlwS2t2Z3plQU14atFGTo8ny1i3zreiJhXJWKL_0GzKW2KmUGUg6ufYWF_T ’_’__
26278,03/08/19 20:03,0,0,2,#NoMoreGuns Politicians Be Active & Stop Letting Us Die.
61529,05/08/19 2:34,5,8,3,@senwarren is responsible for the #DaytonShooting because the shooter was one of her supporters. #LiberalismIsAMentalDisorderhttps://www.washingtontimes.com/news/2019/aug/4/connor-betts-ohio-gunman-was-elizabeth-warren-supp/ ’_’__
60149,05/08/19 2:54,0,0,3,#Cloudflare announces termination of #8chan's service: Cloudflare has announced that’_’__ https://goo.gl/fb/FxScjn #tech
35702,03/08/19 5:26,0,0,1,"#guns #2A Gov. Ducey plans another attempt at gun measure rejected before: ’_’__ was enough to get the National Rifle Association to back off. But enough ’_’__ , and infringing heavily upon their Second Amendment rights,’_’_Îù said Farnsw http://tinyurl.com/yy77m46a pic.twitter.com/R2tI3NYtYE"
22338,03/08/19 20:40,0,0,3,"Antifa groups were spontaneous anti-fascists that faught against the national socialists well before and into world war 2, some German communist members (KPD) are alleged to have joined the Nazis to take down the centrists in '33. Read a book and get off YouTube and 8chan."
20080,03/08/19 21:00,0,0,3,El Paso is in my thoughts and prayers.. But are ’_’_Îùthoughts’_’_Îù and ’_’_Îùprayers’_’_Îù enough? Please do something!!! Enough with these mass shootings! #ElPaso
32629,03/08/19 18:48,2,1,3,"3 people in custody, multiple dead. #ElPaso"
63512,05/08/19 2:07,0,0,3,"My thoughts and prayers really go out to those affected by the #massshootings in #ElPaso, TX and #Dayton, OH. Racism, bigotry, and continues to terrorize the #UnitedStates. #EnoughIsEnoughStopTheHate"
30378,03/08/19 19:21,0,5,3,"I’_’_Î_ve never heard of 8Chan until Scott’_’_Î_s tweet. Like all the Chan sites, they’_’_Î_re always full of evil"
24179,03/08/19 20:23,2,2,3,"Another mass shooting. It appears he specifically targeted Latinx people. Let's use the correct language. This is yet another AMERICAN POGROM, like #TreeOfLife synagogue was. #Trump is directly responsible for fomenting this. #ElPaso"
2352,03/08/19 23:42,0,7,3,"Many years ago, I submitted this for inclusion in a public art project in the EP Intl Airport. Ever time I return, I stop and reread and feel like I'm home when I see this. Today, I'm feeling this harder than I ever have. #ElPasoStrong #eptx #elpasotx #elpaso #gunsafetynowpic.twitter.com/pj5XwNnQBz"
40870,05/08/19 12:29,0,0,2,"Yes, my right not to live in fear of people who feel the need to own assault weapons. Rights are not given by God, if that's what you mean by inherent. Your very questionable ""gun rights"" are trampling my right to the pursuit of happiness. You got the 2a talking points down tho."
62487,05/08/19 2:21,0,1,3,Reported #Dayton #ElPaso pic.twitter.com/2fJeWfnmNk
61392,05/08/19 2:36,0,1,1,Agree completely. Each state’_’_Î_s National Guard fulfills 2A.
10167,03/08/19 22:26,1,0,2,"There were plenty of ’_’_’Œgood guys with guns’_’_Îù openly carrying today during the #ElPasoShooting chaos that It was hard to differentiate bad from good. With all these folks with guns, no one stopped this from happening! Not one! #massshooting #GunControlNow"
65791,05/08/19 1:36,0,0,2,How many lives will it take @realDonaldTrump? #GunControlNow pic.twitter.com/SIw7Xrpt8c
46498,05/08/19 10:02,3,10,3,#Cloudflare Cuts Ties With #8chan In Light Of Mass Shooting and Upcoming IPO http://lowy.at/AO523 pic.twitter.com/W58qh8kqKp
10722,03/08/19 22:20,2,5,3,"Twitter, why did you remove @thedoo2u's tweet? She was just reporting the facts: ""The El Paso shooter is Patrick Cruisius, 21, white, male, avid Trump supporter. Is anyone surprised by this? #ElPaso #WalmartShooting""https://twitter.com/thedoo2u/status/1157768932012392448 ’_’__"
2613,03/08/19 23:40,0,3,2,You may be asking when will politicians that support @realDonaldTrump send more than their thoughts and prayers? It won't be till the criminal behind that is a poc because they can blame it on immigration. That's the unfortunate truth bc so far they are not poc. #EndGunViolence
20919,03/08/19 20:54,8,7,3,"All of these deaths are senseless and sad, but while #ElPaso will be dominating the news/political discourse, the crickets will continue in regards to Chicago. 9 Killed, 39 Wounded In Weekend Shootings Across Chicago https://cbsloc.al/2Zoj5j6#.XUXzg2bu3vE.twitter ’_’__"
19722,03/08/19 21:03,0,0,1,"Again, you need to brush up on your education. The 2A had the ’_’_’Œwell regulated militia’_’_Îù clause because who was the ’_’_’Œmilitia’_’_Îù in 1776? EVERYONE. Everyone was called up to be in the militia and guess what? They brought their OWN firearms. And we fought our gov, not a random nation."
50582,05/08/19 6:44,2,2,1,I was called racist 6x today for standing up for our #2A .. whatta joke
45254,05/08/19 10:49,0,0,3,"Dear America, I'm sorry, we give up. You do nothing to help yourself and it's exhaustive for us to keep supporting someone who doesn't want to help themselves. We love you, but we have to to let you go. #elpaso #walmartshooting #NRAIsComplicit #thoughtsandprayersdontwork"
20986,03/08/19 20:53,0,1,2,At what point will we start saying your right to own an AK47 is not more important than everyone else’_’_Î_s right to live. And let’_’_Î_s call this all what it is - white supremacists with mental health issues and assault weapons. #GunControlNow
21888,03/08/19 20:44,0,0,3,"And these are the same cockroaches that call legitimate journalism ""Fake News"" #ElPaso"
39719,05/08/19 12:50,1,2,1,How about mental health because you can give it up if you think we're going to give up our #2A rights. Dream on. Raise the age to buy guns to 28 because it's obvious modern day young people don't have stable mental faculties to handle the responsibility
56630,05/08/19 3:52,0,0,3,future #8chan #asmr https://8ch.net/asmr/res/177823.html ’_’__
46362,05/08/19 10:06,0,1,3,3A from the roots 2A from the ends https://twitter.com/yoongiftedz/status/1158089646330585088 ’_’__
14342,03/08/19 21:48,0,0,3,Douglas Murray's #propaganda in his xenophobic/Islamophobic book 'The Strange Death of Europe' VERSUS the 'Great Replacement' manifestos of #ElPaso terrorist Patrick Crucius and NZ terrorist Brenton Tarrant. #Terrorism #Radicalization #Trump #Fearhttps://mobile.twitter.com/DouglasKMurray/status/1135894670339432448 ’_’__
48186,05/08/19 8:35,0,1,3,To amend or revoke 2A is obviously a constitutional issue. Fully automatic rifles are already heavily regulated. Others could be. Trump banned bump stocks - but not for over a year giving anyone who wanted one plenty of time...
47536,05/08/19 9:10,0,0,3,#iamscared #guns #elpaso #2ndamendment #shooting @NRA @NRACountry nrasupporters @cnnpolitics cnn msnbc foxnews @npr nprpolitics https://www.instagram.com/p/B0xtqp7HfZ3/?igshid=izgktgg7gn57 ’_’__
50654,05/08/19 6:41,1,8,3,"8chan Is a Megaphone for Gunmen. ’_’_’_Shut the Site Down,’_’_Î_ Says Its Creator. https://nyti.ms/2YHCIkS"
69400,05/08/19 0:35,0,0,3,Ohio shooter had a ’_’_’_kill list’_’_Î_ during a thwarted incident in high school: former student. #DomesticWhiteTerrorism #GetWoke #DaytonShooting https://www.rawstory.com/2019/08/ohio-shooter-had-a-kill-list-during-a-thwarted-incident-during-high-school-former-studen ’_’__ SUBSCRIBE to the LIVE Daily Show!http://makeitplain.com
70902,05/08/19 0:06,0,0,2,The new reality! #EnoughIsEnough #StopGunViolence #MomsDemandAction #VoteThemOuthttps://twitter.com/nachosarah/status/1158088476903874560 ’_’__
35232,03/08/19 13:19,0,0,1,It is time for the hysteria to end and common sense to rule. The 2A should be the law everywhere! https://twitter.com/GunOwners/status/1157340496412532736 ’_’__
58402,05/08/19 3:21,0,0,3,Where do you think 8chan will migrate to? #cloudflare be shuttin em down
9756,03/08/19 22:30,0,0,3,"I just read a tweet calling the #ElPaso shooter a white supremacist and that @realDonaldTrump was complicit in this behavior. Make no mistake about it, #mushroomdick #cheetolini is not complicit, he’_’_Î_s an active proponent of this behavior. This is the exact goal of his rhetoric!"
59945,05/08/19 2:57,19,49,3,We’_’_Î_re starting to learn the names and stories of some of the victims in the #ElPaso shooting. We’_’_Î_re holding their families and communities in our hearts. https://kfoxtv.com/news/local/list-of-victims-from-el-paso-shooting ’_’__
58728,05/08/19 3:15,1,0,3,@TheDemocrats you are the only real responsibles of this madness! #ObamaWasBetterAt creating hating groups like #AntifaDomesticTerrorists #daytonshooting #ConnorBetts #SocialismKillshttps://twitter.com/TrumpJew/status/1158126901556367362 ’_’__
35471,03/08/19 9:57,0,0,3,Last season Charlotte spiral into 2A now it's into 3F damn great
32010,03/08/19 18:58,1,1,3,Update: Police say they have one person in custody. There are multiple fatalities. #ElPaso @wsyx6
59442,05/08/19 3:04,1,0,3,Donald Trump’_’_Î_s comments today about the #ElPasoTerroristAttack and the #DaytonMassShooting show that he is mentally unfit for the office of the President. He encourages violence and is a racist. He lied when he said this administrative has done more than others on #GunControl
8831,03/08/19 22:39,0,1,2,"I was in walmart this morning. To think this could have happened in my town makes me sick. 19 souls lost so far, how many more before we have stricter gun laws? #GunControlNow"
66382,05/08/19 1:26,1,10,2,#GunSense Expanded background checks/waiting periods Closing the gun show loophole Red flag laws Ban certain military-style assault weapons Limit size of ammunition magazines Training/licensing Restriction on purchases of assualt gear Fund mental heath care
28403,03/08/19 19:41,1,8,2,"Today it's #ElPaso , tomorrow it could be your office, your grocery store, your child's school. This has to stop. We can stop it. #GunReformNow #thoughtsandprayers"
8502,03/08/19 22:42,0,0,3,This sounds like something from Tarantinos From Dusk Till Dawn. Unfortunately it is not a movie but the senseless reality we live in. #ElPaso
1090,03/08/19 23:51,0,1,3,#ElPaso #ELPASOMALL #elpasoshooting #walmartshooting #massshootings The #elpasoshooter felt the same way. https://twitter.com/realDonaldTrump/status/1056919064906469376 ’_’__
38873,05/08/19 13:06,0,0,1,"If you're for taking innocent people's guns away, and in turn their chance of defending themselves, but you're against the death penalty for the shooters in #ElPaso and #Dayton .... you might want to check yourself."
67589,05/08/19 1:05,0,5,3,"Yes. It’_’_Î_s not just their silence or rhetoric. Rs in #txlege have reinforced the demonization of immigrants & Latinx Texans thru their policy agenda. Supporting SB4, bogus DPS ’_’_’Œborder security’_’_Îù money, Whitley’_’_Î_s voter purge...all stoke the fires that lead to racist violence #ElPaso https://twitter.com/ChrisGTurner/status/1158035287286648832 ’_’__"
39531,05/08/19 12:54,0,0,3,Texas Walmart shooting: What is extreme message board 8chan? http://sunnyhoi.blog/R9hslb pic.twitter.com/Lx6g5wHsJM
66755,05/08/19 1:20,0,1,2,3 mass shootings in the US in one week and two of them just hours from each other. We are all dead people walking. It’_’_Î_s just a matter of time. @USCongress @USHouseofReps must act. #StopGunViolence
20473,03/08/19 20:57,1,3,3,"This is APPARENTLY the last post of the shooter. Again unconfirmed, but he specifically mentions Walmart, unlikely a coincidence #ElPaso pic.twitter.com/n8BfzTAj18"
2463,03/08/19 23:41,0,1,2,The entire nation is sickened by our government’_’_Î_s uncaring attitude towards the life of it’_’_Î_s citizens. Enough with the phony sympathy. Do something about it! #GunControlNow #GunReformNow
21769,03/08/19 20:46,0,0,2,#GunControlNow Complicit asshole pic.twitter.com/DBbxA05fGx
15859,03/08/19 21:37,92,87,3,UPDATE: Now At Least 19 Dead in Walmart Attack in El Paso Texas Shooting. #ElPasoShooting #ElPaso https://www.nbcwashington.com/news/national-international/El-Paso-Police-Report-Shooter-at-Mall-516373781.html?akmobile=o ’_’__
45475,05/08/19 10:42,0,0,3,"The AR ban, should be a slam-dunk. Inarguable among the sober or sane Even among the 2A morons who can't read, there are two linked, easy-to-digest words in that text: ""well-regulated"" @fred_guttenberghttps://twitter.com/fred_guttenberg/status/1158325586282070016 ’_’__"
55465,05/08/19 4:16,18,30,3,4Chan's /pol/ is looking kind of nervous at the 8chan takedown. pic.twitter.com/hI2wNinwWx
22564,03/08/19 20:38,7,18,3,"President Trump says he spoke to Gov. Abbott about the shooting in #ElPaso to pledge total support of the federal government. Ends tweet with ""God be with you all!"" Live Coverage http://on.nbcdfw.com/0fyawIc"
31963,03/08/19 18:59,0,1,3,Active shooter in El Paso. He has a manifesto on 8chan.
26790,03/08/19 19:58,2,2,2,@GregAbbott_TX Are you still embarrassed? You should be for even tweeting this in the first place. #elpasoshooting #HowManyHaveToDie #GunControlNow https://twitter.com/GregAbbott_TX/status/659427797853536256 ’_’__
25826,03/08/19 20:08,0,0,2,I am fucking tired of your #SecondAmendment rights interfering with my #FirstAmendment right to go out and peaceably assemble in this country. Fuck you @NRA AND @GOPhttps://twitter.com/washingtonpost/status/1157736041090048000 ’_’__
11985,03/08/19 22:08,0,2,2,"I support banning military-style assault weapons, because there's no good reason why civilians need killing machines that were meant for war zones. #BanAssaultWeapons"
1219,03/08/19 23:50,0,1,3,"Sorry, I must have missed the part in the #2A where it said it was limited to common guns of that era."
41034,05/08/19 12:26,0,1,3,#MakeTexasGreatAgain A #WhiteSupremacist group in #Texas that use the same language than #Trump and #ElPaso #TrumpTerroristpic.twitter.com/itNGsNpGLY
49610,05/08/19 7:24,0,2,3,"’_’_’ŒWe are a community, not a band of racists’_’_Îù The promoted content section, where users can pay to have stories published on the front page, is literally called ’_’_’ŒKing of the Shekel’_’_Îù #8chan is a cesspool of degenerate ideologies and extremism built on the free speech grift https://twitter.com/gwensnyderPHL/status/1158204624458997760 ’_’__"
13825,03/08/19 21:52,0,0,2,We need common sense gun control and I’_’_Î_m sure that still isn’_’_Î_t on the table for the ’_’_’Œsupport’_’_Îù #fucktheNRA #EndGunViolence #EnoughIsEnough #ElPaso #massshootinghttps://twitter.com/realDonaldTrump/status/1157757443901972480 ’_’__
16883,03/08/19 21:28,0,0,2,One more reason #MoscowMitch deserves out of senate #GunControlNow https://twitter.com/WbsMark/status/1157753300839731200 ’_’__
41743,05/08/19 12:12,0,2,3,You know what's ironic? The same people who have stockpiled guns to use against a tyrannical government have been systematically voting for the very politicians who are turning the USA into a tyrannical government. #GunControlNow #WhiteSupremacistInChief
56994,05/08/19 3:44,0,1,3,You reap what you sow. #8chan https://www.gizmodo.com.au/2019/08/report-cloudfare-just-terminated-their-dealings-with-8chan/ ’_’__
42771,05/08/19 11:50,0,0,3,Common sense please why need immigration reform when the shooter is from this own country. #ElPasoShooting #ElPasoStrong #ElPaso #massshootingshttps://twitter.com/realDonaldTrump/status/1158330513951735809 ’_’__
2492,03/08/19 23:41,0,0,2,Do you really want to help them? Resign and let someone with some sense take your job. The president radicalizes his #TrumpTerrorists and you say nothing. #MoscowMitch refuses to vote on bills that would enforce #GunControlNow and you say nothing. This #MAGAShooter is on you.
46812,05/08/19 9:48,0,0,3,My heart aches to hear #ElPaso so shooting victims. I'm praying for everyone. pic.twitter.com/n1zq06dYNL
1997,03/08/19 23:44,0,0,1,No doubt there would be arguments. But I tend to agree with Scalia: the original intent of the 2A was to preserve the right protected under the English Bill of Rights. The Bill of Rights permits regulation of gun ownership.
8184,03/08/19 22:45,58,145,3,"Just heard about mass shooting in #ElPaso. Media spinning it as some crazy Trump supporter going nuts. If this is true, let me be the first to say: no #TrumpSupporter I know would EVER do or condone this type of madness and murder. Praying for the victims of #ElPasoShooting."
35727,03/08/19 5:07,1,3,1,One more time. Read my tweet...2A is not the same as the government militia. Are we clear? https://twitter.com/CONSMILITIA/status/1157517996723777536 ’_’__
8519,03/08/19 22:42,0,1,2,"If y’_’_Î_all twitter people REALLY WANT #GunControlNow as much as I do: Get off of Twitter, stop using hashtags, and register to vote! Coming from a 16-year-old who already pre-registered, we have to vote for people who will give us gun laws; hashtags won’_’_Î_t fix shit, voting will!!! pic.twitter.com/H1EqDwRSYD"
7906,03/08/19 22:47,0,1,3,"Me too! Watching . @BarackObama face the nation with tears, i had such hopes that #sandhook would be the last #ElPaso"
2815,03/08/19 23:38,85,216,2,"You're a liar. House passed gun control measures backed by our people. You're blocking HR8 from even being voted on in the Senate. You call yourself the #GrimReaper, & truer words were never spoken. You ought to dig the graves of the mamas' babies murdered today in #ElPaso."
56839,05/08/19 3:47,0,2,3,So now that the 8chan owner has sold to another owner and has nothing to lose he calls for it to close down......that's real big of him.....
63179,05/08/19 2:12,0,0,3,"This guy is an amazing astroligist that is amazing, he is doing a live view right now talking about !, 8chan, shooters and more great stuff. Sunday Night Astro Live -- Harris v Gabbard charts, Williamson 2.0, El P... https://youtu.be/m0cJm-FOJL4 via @YouTube"
836,03/08/19 23:53,0,0,3,"#ElPaso: The attacker was arrested on the west side of the Walmart after surrendering to approaching police officers. Gov. Greg Abbott has described the shooting as ""one of the most deadly days in the history of Texas."""
22610,03/08/19 20:38,1,9,2,"#ElPaso #Walmart People, INNOCENT people & also kids are getting killed, yet nothing gets changed. Why? Because BIG CORPORATES have to make their money from people's misery!"
48842,05/08/19 8:01,0,1,2,’_’_’ŒPeddling to racism is just as bad as being a racist.’_’_Îù Ana Navarro This is what Trump does that helps embolden these people to commit acts of violence. #EndGunViolence #nomoreshootings
21347,03/08/19 20:50,0,1,3,We cannot accept this as normal! #ElPaso #MassShooting #NeverAgainhttps://soundcloud.com/duckfoot-johnson/the-bloody-teddy-bears-now-is-not-the-time ’_’__
91,03/08/19 23:59,0,1,2,Can we talk about it now??? How about now? Now? Now?? Now??? #GunControlNow #ElPasoStrong #EndGunViolence #ENOUGH #MakeItStop
69591,05/08/19 0:31,0,0,3,TBC: The @NRA is not a 2a organization. It is the organization putting together white extremists and guns with the belief that an armed uprising is the only way to stop white people from loosing control of the country.
27475,03/08/19 19:50,0,1,2,Damn this shooter! Maximum penalty! IT HAS TO STOP! #GunControlNow #GunControlNow #GunControlNow
70778,05/08/19 0:08,0,0,2,You are right we have the right to free speech until up to a point where speech incites imminent lawless action or likely to produce such action; then one cannot claim free speech. You see their are limits to all rights just as their are limits to 2A.
19985,03/08/19 21:01,0,0,2,"Who wants to walk around town openly carrying a semi-auto? Ans, nutjobs #GunControlNow"
3166,03/08/19 23:36,31,76,3,"Cell Phone Video from inside El Paso Walmart during today’_’_Î_s mass Shooting... The only thing more Tragic than this mass shooting, will be the next one... When will it be enough? #ElPaso pic.twitter.com/w7d92tjkO8"
56422,05/08/19 3:56,2,5,2,Not when #massshootings happen TOO FUCKING OFTEN for us to EVER be able to talk about #GunViolence. And put me down for using my mass-shot dead body as a political tool while the blood is still warm enough to write #GunControlNow. https://twitter.com/MarkYoungTruth/status/1157850458544889856 ’_’__
56702,05/08/19 3:50,0,0,3,Cloudflare cuts off far-right message board 8chan after El Paso shooting https://www.theguardian.com/us-news/2019/aug/05/cloudflare-8chan-matthew-prince-terminate-service-cuts-off-far-right-message-board-el-paso-shooting?CMP=twt_gu&utm_medium=&utm_source=Twitter#Echobox=1564976496 ’_’__
38943,05/08/19 13:05,0,0,3,Cloudflare Drops 8Chan Following El Paso Mass Shooting ’_’_’Â Blames Website for ’_’_’ŒInspiring’_’_Îù Mass Murder https://www.thegatewaypundit.com/2019/08/cloudflare-drops-8chan-following-el-paso-mass-shooting-blames-website-for-inspiring-mass-murder/ ’_’__
26281,03/08/19 20:03,1,6,3,Could you pry yourself away from your golf game long enough to acknowledge the shooting in ElPaso?
10978,03/08/19 22:18,0,0,2,El Paso shooting should result in a question added to the application for gun license. Are you a fan of #Trump? If yes no gun. #ElPasoShooting #GunControlNow
16379,03/08/19 21:33,0,1,3,#ElPaso Police: The scene of the shooting will remain active for the rest of the day and possibly into the night.
52503,05/08/19 5:36,0,0,3,He came to kill Hispanics': peaceful #ElPaso left wounded by possible #hatecrime https://buff.ly/2yFIHvQ pic.twitter.com/zXTkgyIPWt
40641,05/08/19 12:33,0,0,2,El Paso congresswoman reacts with disgust after hearing Trump tweet blaming media for shootings https://www.rawstory.com/2019/08/el-paso-congresswoman-reacts-with-disgust-after-hearing-trump-tweet-blaming-media-for-shootings/#.XUgh7oqFOQY.twitter ’_’__ #massshootings #gunreformnow #GunControlNow #DaytonStrong #WhiteSupremacistTerrorism #ElPasoTerroristAttack #massshootings #WhiteNationalistTerrorism
